<xs:schema xmlns:xs="http://www.w3.org/2001/XMLSchema"
           targetNamespace="http://example.com/orders"
           xmlns:ord="http://example.com/orders"
           elementFormDefault="qualified">

  <xs:element name="orders">
    <xs:complexType>
      <xs:sequence>
        <xs:element name="order" maxOccurs="unbounded">
          <xs:complexType>
            <xs:sequence>
              <xs:element name="orderId" type="xs:string"/>
              <xs:element name="customerId" type="xs:string"/>
              <xs:element name="orderDate" type="xs:date"/>
              <xs:element name="items">
                <xs:complexType>
                  <xs:sequence>
                    <xs:element name="item" maxOccurs="unbounded">
                      <xs:complexType>
                        <xs:sequence>
                          <xs:element name="itemId" type="xs:string"/>
                          <xs:element name="productName" type="xs:string"/>
                          <xs:element name="quantity" type="xs:integer"/>
                          <xs:element name="price" type="xs:decimal"/>
                        </xs:sequence>
                      </xs:complexType>
                    </xs:element>
                  </xs:sequence>
                </xs:complexType>
              </xs:element>
              <xs:element name="totalAmount" type="xs:decimal"/>
            </xs:sequence>
          </xs:complexType>
        </xs:element>
      </xs:sequence>
    </xs:complexType>
  </xs:element>

</xs:schema>