<?xml version="1.0" encoding="UTF-8"?>
<orders xmlns:xsi="http://www.w3.org/2001/XMLSchema-instance"
        xsi:schemaLocation="http://example.com/orders/v1 ../../schemas/customer_orders.xsd">
    <order>
        <orderId>ORD-2024-001</orderId>
        <customerId>CUST-12345</customerId>
        <orderDate>2024-01-15</orderDate>
        <items>
            <item>
                <itemId>ITM-001</itemId>
                <productName>Wireless Mouse</productName>
                <quantity>2</quantity>
                <price>29.99</price>
            </item>
            <item>
                <itemId>ITM-002</itemId>
                <productName>USB Cable</productName>
                <quantity>5</quantity>
                <price>9.99</price>
            </item>
        </items>
        <totalAmount>109.93</totalAmount>
    </order>
    <order>
        <orderId>ORD-2024-002</orderId>
        <customerId>CUST-67890</customerId>
        <orderDate>2024-01-16</orderDate>
        <items>
            <item>
                <itemId>ITM-003</itemId>
                <productName>Keyboard</productName>
                <quantity>1</quantity>
                <price>79.99</price>
            </item>
        </items>
        <totalAmount>79.99</totalAmount>
    </order>
    <order>
        <orderId>ORD-2024-003</orderId>
        <customerId>CUST-11223</customerId>
        <orderDate>2024-01-17</orderDate>
        <items>
            <item>
                <itemId>ITM-004</itemId>
                <productName>Monitor Stand</productName>
                <quantity>1</quantity>
                <price>45.50</price>
            </item>
            <item>
                <itemId>ITM-005</itemId>
                <productName>HDMI Cable</productName>
                <quantity>2</quantity>
                <price>15.99</price>
            </item>
            <item>
                <itemId>ITM-006</itemId>
                <productName>Laptop Sleeve</productName>
                <quantity>1</quantity>
                <price>24.99</price>
            </item>
        </items>
        <totalAmount>102.47</totalAmount>
    </order>
    <order>
        <orderId>ORD-2024-004</orderId>
        <customerId>CUST-44556</customerId>
        <orderDate>2024-01-18</orderDate>
        <items>
            <item>
                <itemId>ITM-007</itemId>
                <productName>Webcam</productName>
                <quantity>1</quantity>
                <price>89.99</price>
            </item>
            <item>
                <itemId>ITM-008</itemId>
                <productName>Microphone</productName>
                <quantity>1</quantity>
                <price>129.99</price>
            </item>
        </items>
        <totalAmount>219.98</totalAmount>
    </order>
</orders>